{
  "id": "T017",
  "kind": "implementation",
  "title": "Add non-road ground support and automatic fall recovery",
  "status": "done",
  "priority": "high",
  "depends_on": ["T006", "T009"],
  "areas": ["world-runtime", "player-experience"],
  "requirements": ["FR-010", "FR-012", "QR-003"],
  "requires": ["repo-write", "shell"],
  "prefers": ["browser-interaction", "vision"],
  "acceptance": [
    "slight departures from a Roadbed polygon no longer immediately enter an endless black void; the active streamed region provides a bounded non-road support/terrain surface suitable for the current flat prototype fixture",
    "non-road support does not replace or duplicate the authoritative Roadbed driving surface and is clearly separated so T010 elevation/grade-separation work can replace or reshape terrain without creating false flat intersections",
    "leaving the playable support region, falling below a configurable safety threshold, or otherwise entering an unrecoverable fall triggers the existing nearby-road recovery flow automatically instead of allowing an endless fall",
    "render and physics ground/support lifecycle is bounded by the same active streaming policy rather than growing with total route distance",
    "automated tests cover support lifecycle and fall-recovery triggering, and a browser pass demonstrates a controlled road departure and recovery"
  ],
  "verify": "npm run check",
  "verification": "PR #10 final reconciled head passed hosted npm run check, project health, lint/types/schemas, and both Ubuntu and Windows Roach coordination validation. Temporary Chromium verification artifact 9747980822 placed the real dynamic chassis on a loaded point classified as support, confirmed stable 4/4 wheel contact, and normal R recovery returned it to Roadbed with 4/4 contacts and no browser/page errors. Temporary verification hook/workflow were removed before merge.",
  "claim": null,
  "handoff": null,
  "review_of": null,
  "correction_of": null,
  "integration": {
    "branch": "roach/T017-chatgpt-nydrive-a830",
    "merge_commit": "92892af0234b24b2999f46952f2d94321292864a",
    "level": "quick",
    "verified_at": "2026-08-31T17:16:51Z"
  },
  "evidence": {
    "work": "Streamed below-Roadbed support ground, grade-separation eligibility guard, bounded support render/physics lifecycle, surface classification diagnostics, and one-shot automatic fall recovery merged through PR #10. Browser artifact 9747980822 verified real Rapier support contact and normal safe-road reset behavior.",
    "work_waived": false,
    "task_check": "passed"
  },
  "completed_at": "2026-08-31T17:16:51Z",
  "commit": "92892af0234b24b2999f46952f2d94321292864a"
}
