{
  "id": "T015",
  "kind": "implementation",
  "title": "Correct reversed steering controls",
  "status": "done",
  "priority": "high",
  "depends_on": [
    "T009"
  ],
  "areas": [
    "player-experience"
  ],
  "requirements": [
    "FR-009",
    "FR-011",
    "FR-012",
    "FR-013"
  ],
  "requires": [
    "repo-write",
    "shell"
  ],
  "prefers": [
    "browser-interaction",
    "vision"
  ],
  "acceptance": [
    "Right/ D input turns the car visually right and left/ A input turns the car visually left in the running browser game; automated coverage protects the steering sign convention."
  ],
  "verify": null,
  "verification": "Corrected vehicle steering sign so semantic right/D input turns visually right and left/A input turns visually left; added regression coverage. npm run check passed; merged verification passed with 28 Vitest tests and 12 map-compiler tests.",
  "claim": null,
  "handoff": null,
  "review_of": null,
  "correction_of": "T009",
  "integration": {
    "branch": "roach/T015-codex-steering-20260831",
    "merge_commit": "3f9c4881851403489b2fccddaec8b02e9033afe4",
    "level": "quick",
    "verified_at": "2026-08-31T05:46:34Z"
  },
  "evidence": {
    "work": "merged as 3f9c4881",
    "work_waived": false,
    "task_check": "none"
  },
  "completed_at": "2026-08-31T05:46:56Z",
  "commit": "2c20d8bfc3465543c93f9f6b25d7fe8d76bf0783"
}
