{
  "id": "T000",
  "kind": "discovery",
  "title": "Define product with owner",
  "status": "done",
  "priority": "urgent",
  "depends_on": [],
  "areas": [
    "product-definition"
  ],
  "requirements": [],
  "requires": [
    "repo-write",
    "user-dialogue"
  ],
  "prefers": [
    "web-research"
  ],
  "acceptance": [
    ".agent/PRODUCT.md contains the required core sections and captures the owner's accepted product intent with no critical ambiguity blocking planning",
    ".agent/PROJECT.md contains a concise orientation summary instead of the template placeholder",
    "roach.py accept-product completes this discovery task and records accepted product state without a separate finish step",
    "a planning task exists and .agent/PLAN.md has been initialized for autonomous technical planning"
  ],
  "verification": "Owner explicitly asked to initialize this repository from the NYC driving-game concept developed in the conversation; PRODUCT.md and PROJECT.md capture that intent and non-blocking open questions are separated from accepted scope.",
  "claim": null,
  "handoff": null,
  "review_of": null,
  "correction_of": null,
  "verify": null,
  "integration": null,
  "evidence": null,
  "completed_at": null,
  "commit": null
}
