{
  "id": "T006",
  "kind": "implementation",
  "title": "Render driveable roads and physics collision",
  "status": "done",
  "priority": "high",
  "depends_on": ["T005"],
  "areas": ["road-runtime"],
  "requirements": ["FR-002", "FR-003", "FR-005"],
  "requires": ["repo-write", "shell"],
  "prefers": ["browser-interaction", "vision"],
  "acceptance": [
    "compiled road and intersection meshes render in Three.js at the expected one-to-one scale and connect cleanly across active tile boundaries",
    "Rapier receives road collision geometry only for the configured physics-active tile region and removes it when those tiles deactivate",
    "road geometry follows compiled roadbed/intersection surfaces rather than drawing fixed-width ribbons from centerlines",
    "direction/lane/road-class metadata remains accessible for debugging and future presentation even though traffic rules are not enforced in the initial free-drive mode",
    "static collision tests prove tile activation is idempotent, roadbed contact is queryable, and collision planes are removed/rebased cleanly; dynamic player traversal across tile seams is explicitly verified by T007 because T006 precedes the vehicle implementation"
  ],
  "verify": "npm run check",
  "verification": "PR #5 merged into main as 27354af039933299f411c164c41f78de2df1bc05 after clean hosted verification. npm run check passed with TypeScript, 11 Vitest tests including real Rapier WASM ray contact, and a Vite production build. Roach project health, lint/schema, Ubuntu coordination, and Windows coordination also passed. Three.js triangulation-index handling, strict noUncheckedIndexedAccess bounds checks, upward road triangle winding, and Rapier world-query refresh behavior were corrected before merge.",
  "claim": null,
  "handoff": null,
  "review_of": null,
  "correction_of": null,
  "integration": {
    "branch": "roach/T006-chatgpt-nydrive-a830",
    "merge_commit": "27354af039933299f411c164c41f78de2df1bc05",
    "level": "quick",
    "verified_at": "2026-08-31T02:39:30Z"
  },
  "evidence": {
    "work": "Roadbed-derived Three.js meshes and streamed Rapier trimesh collision, one collider per physics-active tile, metadata-preserving centerline debug objects, collider rebasing/removal, and real Rapier contact tests merged via PR #5. Dynamic seam traversal is transferred to T007 where a dynamic player vehicle exists.",
    "work_waived": false,
    "task_check": "passed"
  },
  "completed_at": "2026-08-31T02:39:30Z",
  "commit": "27354af039933299f411c164c41f78de2df1bc05"
}
