{
  "id": "T008",
  "kind": "implementation",
  "title": "Tune controllable drift and handbrake behavior",
  "status": "done",
  "priority": "high",
  "depends_on": ["T007", "T009", "T016"],
  "areas": ["vehicle-physics"],
  "requirements": ["FR-007", "FR-008", "FR-011"],
  "requires": ["repo-write", "shell"],
  "prefers": ["browser-interaction", "web-research"],
  "acceptance": [
    "the tire/drivetrain model has a tunable, observable transition from grip to lateral slip instead of binary traction loss",
    "the car no longer exhibits the excessive prototype understeer reported in owner playtesting; speed-dependent steering, front/rear lateral grip balance, steering geometry/response, and bounded physical assists are tuned so ordinary Manhattan right-angle turns are achievable without implausibly low entry speed",
    "the handbrake materially increases rear braking and/or reduces available rear lateral grip so it can initiate or tighten rotation at appropriate speeds instead of behaving like a weak service brake",
    "countersteer and throttle can sustain and recover deliberate oversteer on representative Manhattan corners without requiring scripted drift states",
    "optional arcade assists operate through bounded force/steering/grip adjustments and can be tuned without bypassing the rigid-body simulation",
    "research notes compare relevant open arcade/sim-cade raycast vehicle implementations and document which concepts were adopted or rejected without copying incompatible code",
    "a human browser test using the corrected T016 wide miniature/isometric camera records representative normal cornering, drift initiation, sustain, recovery, handbrake effect, and low-speed stability observations alongside automated force-curve tests"
  ],
  "verify": "npm run check",
  "verification": "PR #9 passed hosted npm run check: strict TypeScript, 34/34 Vitest tests across 14 suites, and production Vite build. Merge-context web runtime, project health, lint/types/schemas, and Ubuntu Roach coordination passed. A temporary production Chromium maneuver on the real Flatiron fixture recorded normal-turn yaw about 47 deg/s with 3.7 deg rear slip, handbrake-turn yaw about 59 deg/s with 6.8 deg rear slip, and countersteer/throttle recovery near 3 deg/s yaw with 0.2 deg rear slip; no console/page errors. The temporary workflow was removed before merge. Exact subjective feel remains data-driven for owner desktop retesting.",
  "claim": null,
  "handoff": "The post-owner-playtest tune is intentionally a strong first pass, not a claim of final subjective handling. Use telemetry plus the owner's next desktop retest for any fine adjustment; preserve T015 steering sign and physics-only drift behavior.",
  "review_of": null,
  "correction_of": null,
  "integration": {
    "branch": "roach/T008-chatgpt-nydrive-a830-v2",
    "merge_commit": "334529ac7f2d3429b76d7fe2168c434392bbd6c3",
    "level": "quick",
    "verified_at": "2026-08-31T06:19:00Z"
  },
  "evidence": {
    "work": "Speed-dependent steering, Ackermann front steering, axle-specific grip/cornering balance, rear-only speed-blended handbrake brake/grip/drive behavior, yaw/rear-slip telemetry, normal-turn and drift/recovery integration tests, and documented open-reference concepts merged through PR #9. Browser artifact 9747455000 recorded normal turn, handbrake initiation, and recovery on the real fixture.",
    "work_waived": false,
    "task_check": "passed"
  },
  "completed_at": "2026-08-31T06:19:00Z",
  "commit": "cbf1e9639f7a186f257c030a1b182a37610d3809"
}
