{
  "id": "T002",
  "kind": "implementation",
  "title": "Scaffold browser runtime and project verification",
  "status": "done",
  "priority": "urgent",
  "depends_on": ["T001"],
  "areas": ["web-runtime", "tooling"],
  "requirements": ["FR-013", "QR-001", "QR-005"],
  "requires": ["repo-write", "shell"],
  "prefers": ["browser-interaction"],
  "acceptance": [
    "a TypeScript + Vite browser application builds and opens with a Three.js scene using a WebGL2-compatible rendering baseline",
    "Rapier 3D/WASM is initialized behind a small physics boundary without coupling game logic directly to package bootstrap details",
    "action-based keyboard input exposes steer, throttle, brake/reverse, handbrake, and reset actions even if vehicle behavior is still placeholder",
    "package scripts provide deterministic typecheck/test/build checks and .agent/VERIFY.json is updated so quick verification includes product-aware checks",
    "third-party runtime dependencies are pinned and their licenses are recorded or mechanically discoverable for later attribution review"
  ],
  "verify": "npm run check",
  "verification": "Public-repository GitHub Actions allocated a clean hosted runner; dependency installation and the declared npm run check both passed. Roach project health, lint/types/schemas, and Ubuntu coordination checks also passed. PR #1 was merged into main as 5e49e8cb57ddf7ff456cb1918f80e991e3e41a2a.",
  "claim": null,
  "handoff": null,
  "review_of": null,
  "correction_of": null,
  "integration": {
    "branch": "roach/T002-chatgpt-nydrive-a830",
    "merge_commit": "5e49e8cb57ddf7ff456cb1918f80e991e3e41a2a",
    "level": "quick",
    "verified_at": "2026-08-30T21:36:51Z"
  },
  "evidence": {
    "work": "14 file(s) changed on main since the claim",
    "work_waived": false,
    "task_check": "passed"
  },
  "completed_at": "2026-08-30T21:36:51Z",
  "commit": "5e49e8cb57ddf7ff456cb1918f80e991e3e41a2a"
}
