{
  "id": "T001",
  "kind": "planning",
  "title": "Plan product implementation",
  "status": "done",
  "priority": "urgent",
  "depends_on": [
    "T000"
  ],
  "areas": [
    "project-planning"
  ],
  "requirements": [],
  "requires": [
    "repo-write"
  ],
  "prefers": [
    "shell",
    "web-research"
  ],
  "acceptance": [
    ".agent/PLAN.md defines the current technical approach and required core planning sections",
    ".agent/VERIFY.json contains the required practical project-health command",
    "the initial execution backlog covers every active accepted requirement",
    "python3 scripts/roach.py ready reports READY after the planning task is finished"
  ],
  "verify": null,
  "verification": "Completed the READY technical plan, configured bootstrap verification, created requirement-linked T002-T014 execution work, fast-forwarded the claimed planning branch to main, and added repository CI that executes roach_check.py plus roach.py ready after coordination changes.",
  "claim": null,
  "handoff": null,
  "review_of": null,
  "correction_of": null,
  "integration": {
    "branch": "roach/T001-chatgpt-nydrive-a830",
    "merge_commit": "f9076dbdb1600c2e3c4aae81441fe6c307f5182f"
  },
  "evidence": {
    "work": "planning branch integrated as f9076dbdb1600c2e3c4aae81441fe6c307f5182f",
    "work_waived": false,
    "task_check": "none"
  },
  "completed_at": "2026-08-30T16:12:30Z",
  "commit": "f9076dbdb1600c2e3c4aae81441fe6c307f5182f"
}
