{
  "id": "T014",
  "kind": "verification",
  "title": "Validate long-route browser performance and driving experience",
  "status": "planned",
  "priority": "high",
  "depends_on": ["T008", "T009", "T011", "T012", "T013"],
  "areas": ["release-validation"],
  "requirements": ["FR-001", "FR-005", "FR-007", "FR-008", "FR-009", "FR-010", "FR-011", "FR-012", "FR-013", "QR-001", "QR-003", "QR-005"],
  "requires": ["browser-interaction", "repo-read", "shell"],
  "prefers": ["vision"],
  "acceptance": [
    "a production browser build can start directly in free driving, render real compiled NYC tiles, and complete representative long routes including at least one cross-borough route without a scene reload that breaks play",
    "measured profiling records frame time, physics time, loaded tile count, active collider count, memory trend, and tile-load hitching while driving far enough that many tiles have been loaded and unloaded",
    "memory/collider counts return toward a bounded steady state after leaving regions rather than growing monotonically with total distance traveled",
    "human browser verification records that steering, braking, AWD grip/slip, handbrake drift initiation/recovery, isometric camera readability, and reset are usable on the real road world",
    "simplified scenery and road geography make representative NYC areas spatially recognizable without requiring photorealistic landmark art",
    "automated browser smoke coverage is added to .agent/VERIFY.json and required license/attribution notices are present in the distributable build"
  ],
  "verify": null,
  "verification": null,
  "claim": null,
  "handoff": null,
  "review_of": null,
  "correction_of": null,
  "integration": null,
  "evidence": null,
  "completed_at": null,
  "commit": null
}
